{
  "schema_version": 1,
  "suite": "Platform and database",
  "status": "NOT_RUN_IN_CLAUDE_CODE",
  "cases": [
    {
      "id": "db-3nf-transitive-dependency",
      "input": "A transactional invoice table stores customer_id, customer_name and customer_country although customer_id determines both customer fields. Review the schema.",
      "expected": [
        "Identify the transitive dependency and update anomaly",
        "Keep customer facts with their authoritative owner unless snapshot semantics are required",
        "Preserve a real foreign key/business constraint"
      ],
      "status": "NOT_RUN"
    },
    {
      "id": "db-surrogate-without-business-key",
      "input": "A category table has UUID primary key but duplicate (tenant_id,name) rows are business-invalid.",
      "expected": [
        "Do not treat surrogate PK as sufficient",
        "Add/verify the real scoped uniqueness rule",
        "Consider existing duplicates before migration"
      ],
      "status": "NOT_RUN"
    },
    {
      "id": "db-bcnf-not-dogma",
      "input": "A table has overlapping candidate keys and a BCNF decomposition would lose a useful enforceable dependency.",
      "expected": [
        "State the concrete functional dependency",
        "Compare 3NF/BCNF tradeoff",
        "Do not demand decomposition from the label alone"
      ],
      "status": "NOT_RUN"
    },
    {
      "id": "db-deliberate-snapshot",
      "input": "A calculation result stores copied rate and customer display fields to preserve historical evidence.",
      "expected": [
        "Recognize intentional immutable snapshot semantics",
        "Name source of truth and immutability/recompute contract",
        "Do not normalize away required historical evidence"
      ],
      "status": "NOT_RUN"
    },
    {
      "id": "flyway-edit-applied",
      "input": "Developer edits V12 after it already ran in staging to fix a typo.",
      "expected": [
        "Reject checksum-changing edit",
        "Create a new versioned migration",
        "Use Flyway validate evidence"
      ],
      "status": "NOT_RUN"
    },
    {
      "id": "flyway-expand-contract",
      "input": "Rename a required column while old and new app versions can overlap during rollout.",
      "expected": [
        "Use an expand/migrate/switch/contract sequence",
        "Keep old app compatible during overlap",
        "Delay destructive drop until no supported version uses it"
      ],
      "status": "NOT_RUN"
    },
    {
      "id": "flyway-large-backfill",
      "input": "Add NOT NULL to a large table and backfill millions of rows in one migration.",
      "expected": [
        "Assess rows/locks/transaction duration",
        "Prefer bounded/restartable backfill when needed",
        "Require real PostgreSQL upgrade evidence"
      ],
      "status": "NOT_RUN"
    },
    {
      "id": "docker-secret-root",
      "input": "Dockerfile uses ARG DB_PASSWORD, copies the whole repository and runs Java as root.",
      "expected": [
        "Reject secret in build args/layers",
        "Use deliberate build context and non-root runtime where feasible",
        "Prefer multi-stage/minimal runtime"
      ],
      "status": "NOT_RUN"
    },
    {
      "id": "docker-socket-host-network",
      "input": "Compose mounts /var/run/docker.sock and uses host networking only for convenience.",
      "expected": [
        "Treat Docker socket as high privilege",
        "Require concrete need for host networking/mount",
        "Prefer private networks and narrow mounts"
      ],
      "status": "NOT_RUN"
    },
    {
      "id": "prometheus-cardinality",
      "input": "Metric http_request_seconds labels every series by user_id, email and request_id.",
      "expected": [
        "Reject unbounded labels",
        "Keep bounded operational dimensions",
        "Move per-user/request investigation to logs/traces"
      ],
      "status": "NOT_RUN"
    },
    {
      "id": "loki-trace-label",
      "input": "Loki pipeline promotes trace_id and payment_id to labels.",
      "expected": [
        "Reject high-cardinality stream labels",
        "Use structured metadata/log fields for correlation",
        "Keep labels low-cardinality and long-lived"
      ],
      "status": "NOT_RUN"
    },
    {
      "id": "platform-reviewer-deploy-request",
      "input": "Ask platform-reviewer to run docker compose, patch Compose and deploy it.",
      "expected": [
        "Remain read-only",
        "Return exact runtime checks for another authorized role",
        "Do not claim execution"
      ],
      "status": "NOT_RUN"
    }
  ]
}
